{
  "schema_version": "h4l-mass-off-evaluation-plan-v1",
  "dataset": "atlas2020_4lep",
  "family_id": "engineered19_raw_T1_m4l_off_attribution_v1",
  "protocol_sha256": "4954e2ec4c4ef8d4b35e24e456940a5485996d607f0a0083f607cf0e2fee5955",
  "registration_status": "exploratory_posthoc",
  "candidate_keys": [
    "M0off:42",
    "M3:42:groups=A:m4l=off",
    "M3:42:groups=B:m4l=off",
    "M3:42:groups=C:m4l=off",
    "M3:42:groups=D:m4l=off",
    "M3:42:groups=AB:m4l=off",
    "M3:42:groups=AC:m4l=off",
    "M3:42:groups=AD:m4l=off",
    "M3:42:groups=BC:m4l=off",
    "M3:42:groups=BD:m4l=off",
    "M3:42:groups=CD:m4l=off",
    "M3:42:groups=ABC:m4l=off",
    "M3:42:groups=ABD:m4l=off",
    "M3:42:groups=ACD:m4l=off",
    "M3:42:groups=BCD:m4l=off",
    "M3:42:groups=ABCD:m4l=off",
    "M0off:43",
    "M3:43:groups=A:m4l=off",
    "M3:43:groups=B:m4l=off",
    "M3:43:groups=C:m4l=off",
    "M3:43:groups=D:m4l=off",
    "M3:43:groups=AB:m4l=off",
    "M3:43:groups=AC:m4l=off",
    "M3:43:groups=AD:m4l=off",
    "M3:43:groups=BC:m4l=off",
    "M3:43:groups=BD:m4l=off",
    "M3:43:groups=CD:m4l=off",
    "M3:43:groups=ABC:m4l=off",
    "M3:43:groups=ABD:m4l=off",
    "M3:43:groups=ACD:m4l=off",
    "M3:43:groups=BCD:m4l=off",
    "M3:43:groups=ABCD:m4l=off",
    "M0off:44",
    "M3:44:groups=A:m4l=off",
    "M3:44:groups=B:m4l=off",
    "M3:44:groups=C:m4l=off",
    "M3:44:groups=D:m4l=off",
    "M3:44:groups=AB:m4l=off",
    "M3:44:groups=AC:m4l=off",
    "M3:44:groups=AD:m4l=off",
    "M3:44:groups=BC:m4l=off",
    "M3:44:groups=BD:m4l=off",
    "M3:44:groups=CD:m4l=off",
    "M3:44:groups=ABC:m4l=off",
    "M3:44:groups=ABD:m4l=off",
    "M3:44:groups=ACD:m4l=off",
    "M3:44:groups=BCD:m4l=off",
    "M3:44:groups=ABCD:m4l=off",
    "M0off:45",
    "M3:45:groups=A:m4l=off",
    "M3:45:groups=B:m4l=off",
    "M3:45:groups=C:m4l=off",
    "M3:45:groups=D:m4l=off",
    "M3:45:groups=AB:m4l=off",
    "M3:45:groups=AC:m4l=off",
    "M3:45:groups=AD:m4l=off",
    "M3:45:groups=BC:m4l=off",
    "M3:45:groups=BD:m4l=off",
    "M3:45:groups=CD:m4l=off",
    "M3:45:groups=ABC:m4l=off",
    "M3:45:groups=ABD:m4l=off",
    "M3:45:groups=ACD:m4l=off",
    "M3:45:groups=BCD:m4l=off",
    "M3:45:groups=ABCD:m4l=off",
    "M0off:46",
    "M3:46:groups=A:m4l=off",
    "M3:46:groups=B:m4l=off",
    "M3:46:groups=C:m4l=off",
    "M3:46:groups=D:m4l=off",
    "M3:46:groups=AB:m4l=off",
    "M3:46:groups=AC:m4l=off",
    "M3:46:groups=AD:m4l=off",
    "M3:46:groups=BC:m4l=off",
    "M3:46:groups=BD:m4l=off",
    "M3:46:groups=CD:m4l=off",
    "M3:46:groups=ABC:m4l=off",
    "M3:46:groups=ABD:m4l=off",
    "M3:46:groups=ACD:m4l=off",
    "M3:46:groups=BCD:m4l=off",
    "M3:46:groups=ABCD:m4l=off"
  ],
  "budgets": {
    "mc_bootstrap": {
      "replicas": 200,
      "seed": 42001
    },
    "toys": {
      "injections": [
        0,
        1,
        2
      ],
      "count": 500,
      "seed": 42
    },
    "t2": {
      "mu": 1,
      "outer_replicas": 20,
      "inner_toys": 100,
      "seed": 42
    }
  },
  "inputs": {
    "registration_artifact_id": "0000000000000000000000000000000000000000000000000000000000000000",
    "prepared_artifact_id": "0000000000000000000000000000000000000000000000000000000000000000",
    "template_artifact_id": "0000000000000000000000000000000000000000000000000000000000000000",
    "freeze_artifact_id": "0000000000000000000000000000000000000000000000000000000000000000",
    "asimov_artifact_id": "0000000000000000000000000000000000000000000000000000000000000000"
  }
}
